graphtype.id,graph.type.name,data.level,data.measure,data.restriction,data.group.by.var,graph.average,graph.avg.group.by.var,graph.x,graph.arrows,graph.constant.y.scale
a,district participation by school,district,participation,,"year,school",yes,,school,0,0
b,school participation by role,school,participation,school,"year,role",yes,"year,role",role,0,0
c,district performance by module,district,performance,,"year,module",yes,"year, module",module,0,1
d,school performance by module,school,performance,school,"year,module",yes,"year, module",module,0,1
e,district participation,district,participation,,year,no,,,1,0
f,district participation by school,district,participation,,"year,school",yes,,school,1,0
g,district performance by school,district,performance,,"year,school",yes,,school,0,1
h,district performance by school,district,performance,module,"year,school",yes,,school,0,1
i,school performance by ans.opt,school,performance,module,"year,ans.opt",no,,ans.opt,0,1
